Id;Username;Email;Body
20;roma;starr_adams@dubuque.example;Velit voluptas modi. Omnis quia dolorem. Consequuntur tempore et.
19;larraine;rowena_hammes@jerde.test;Et vero nulla. Sunt beatae earum. Laborum rem itaque.
18;robbie.schowalter;jenny_weber@sanford-dickinson.test;Eius qui cumque. Temporibus magnam id. Est eligendi ut.
17;edwina.hagenes;granville@frami.example;Omnis nesciunt est. Aliquam praesentium tempora. Occaecati at accusamus.
16;raphael_grant;garret_mayer@collins.test;Iusto repellat eius. Ut non eum. Aut voluptas ut.
15;esperanza;candida@baumbach.example;Esse rerum est. Ut tenetur enim. Vero quasi odio.
14;eleanora.wilkinson;guillermo@mueller.example;Vero itaque autem. Mollitia omnis cum. In consequatur explicabo.
13;travis_casper;omega@gerlach.example;Commodi itaque dignissimos. Fugit error itaque. Iure hic repudiandae.
12;theo_harber;chase@wiegand-boehm.example;Molestiae vero incidunt. Voluptatibus vero est. Molestias sapiente quia.
11;brittani_waelchi;man.bogisich@harvey.test;Et ab quibusdam. Unde necessitatibus atque. Eum blanditiis recusandae.
10;toccara_barton;thaddeus@murray.test;Et suscipit impedit. Qui odio consectetur. Sint ut veniam.
9;ed.steuber;andy@toy.example;Deleniti quam minima. Similique quisquam omnis. Nesciunt velit deserunt.
8;ronald;lindsay@dach.test;Repellendus quas fuga. Sapiente suscipit eligendi. Dolore est saepe.
7;claud.kihn;jina_cruickshank@dare.example;Reiciendis vel eum. Est esse ut. Tempore blanditiis et.
6;young_casper;jamie@russel.example;Ipsam recusandae est. Molestiae labore non. Hic ratione cum.
5;nolan_hand;jamaal.breitenberg@bosco.example;Facilis consequatur culpa. Et enim omnis. Nulla iure est.
4;yung;rosalba@goyette.example;Necessitatibus autem libero. Voluptatibus et eos. Ipsam voluptatem ratione.
3;emilio;delila.mann@quigley-predovic.test;Dicta cumque occaecati. Tenetur ad dolores. Est sit rerum.
2;wilhemina;jessenia_shields@zulauf.test;Impedit quibusdam unde. Facere necessitatibus sed. Assumenda temporibus aut.
1;felisha.wunsch;martin.walker@miller.example;Inventore unde consectetur. Adipisci aut eligendi. Quisquam id quibusdam.
